{
  "settings": {
    "outside": "look",
    "look": "mouse"
  },
  "meta": {
    "author": "Nebula",
    "aspect": 2.17,
    "name": "Touch shooter · keyboard & mouse",
    "description": "Two-thumb shooter layout for games played with keyboard and mouse. The stick is WASD (Shift past the ring, drag up to lock the run), swipe to look with the mouse, left and right mouse buttons on both sides, Space, C, Z, R, F, Q/E lean, Alt free look, Tab, M and Esc.",
    "device": "phone",
    "target": "kbm",
    "tags": [
      "shooter",
      "first-person",
      "third-person",
      "keyboard-mouse",
      "touch-only"
    ]
  },
  "format": "nebula-layout",
  "version": 1,
  "landscape": [
    {
      "role": "move",
      "shape": "square",
      "kind": "zone",
      "bindings": [
        "key:87",
        "key:83",
        "key:65",
        "key:68"
      ],
      "sprint": "key:160",
      "h": 0.76,
      "runLock": true,
      "label": "Move",
      "zone": "floating_stick",
      "w": 0.44,
      "x": 0.22,
      "y": 0.62,
      "stick": "keys",
      "id": "move",
      "deadzone": 0.1,
      "opacity": 0.25
    },
    {
      "role": "fire",
      "kind": "button",
      "bindings": [
        "mouse:left"
      ],
      "w": 64,
      "h": 64,
      "x": 0.075,
      "y": 0.33,
      "id": "fire-left",
      "label": "FIRE"
    },
    {
      "role": "fire",
      "kind": "button",
      "bindings": [
        "mouse:left"
      ],
      "w": 80,
      "h": 80,
      "x": 0.8,
      "y": 0.55,
      "id": "fire",
      "label": "FIRE",
      "lookThrough": true
    },
    {
      "mode": "mixed",
      "role": "ads",
      "kind": "button",
      "bindings": [
        "mouse:right"
      ],
      "w": 58,
      "h": 58,
      "x": 0.925,
      "y": 0.33,
      "id": "ads",
      "label": "ADS"
    },
    {
      "role": "jump",
      "kind": "button",
      "bindings": [
        "key:32"
      ],
      "w": 54,
      "h": 54,
      "x": 0.895,
      "y": 0.6,
      "id": "jump",
      "label": "Jump"
    },
    {
      "role": "crouch",
      "kind": "button",
      "bindings": [
        "key:67"
      ],
      "w": 54,
      "h": 54,
      "x": 0.905,
      "y": 0.83,
      "id": "crouch",
      "label": "Crouch"
    },
    {
      "role": "prone",
      "kind": "button",
      "bindings": [
        "key:90"
      ],
      "w": 48,
      "h": 48,
      "x": 0.795,
      "y": 0.9,
      "id": "prone",
      "label": "Prone"
    },
    {
      "role": "reload",
      "kind": "button",
      "bindings": [
        "key:82"
      ],
      "w": 50,
      "h": 50,
      "x": 0.69,
      "y": 0.88,
      "id": "reload",
      "label": "Reload"
    },
    {
      "role": "switch",
      "kind": "button",
      "bindings": [
        "wheel:down"
      ],
      "w": 48,
      "h": 48,
      "x": 0.585,
      "y": 0.88,
      "id": "swap",
      "label": "Swap"
    },
    {
      "role": "interact",
      "kind": "button",
      "bindings": [
        "key:70"
      ],
      "w": 48,
      "h": 48,
      "x": 0.62,
      "y": 0.66,
      "id": "use",
      "label": "F"
    },
    {
      "role": "free_look",
      "kind": "button",
      "bindings": [
        "key:164"
      ],
      "w": 50,
      "h": 50,
      "x": 0.69,
      "y": 0.3,
      "id": "eye",
      "label": "Eye",
      "lookThrough": true
    },
    {
      "mode": "toggle",
      "role": "peek_left",
      "shape": "pill",
      "kind": "button",
      "bindings": [
        "key:81"
      ],
      "w": 72,
      "h": 40,
      "x": 0.26,
      "y": 0.1,
      "id": "peek-left",
      "label": "◀ Peek"
    },
    {
      "mode": "toggle",
      "role": "peek_right",
      "shape": "pill",
      "kind": "button",
      "bindings": [
        "key:69"
      ],
      "w": 72,
      "h": 40,
      "x": 0.74,
      "y": 0.1,
      "id": "peek-right",
      "label": "Peek ▶"
    },
    {
      "kind": "button",
      "bindings": [
        "key:9"
      ],
      "w": 44,
      "h": 44,
      "x": 0.925,
      "y": 0.1,
      "id": "melee",
      "label": "Bag"
    },
    {
      "role": "menu",
      "shape": "pill",
      "kind": "button",
      "bindings": [
        "key:77"
      ],
      "w": 60,
      "h": 34,
      "x": 0.43,
      "y": 0.07,
      "id": "map",
      "label": "Map"
    },
    {
      "role": "menu",
      "shape": "pill",
      "kind": "button",
      "bindings": [
        "key:27"
      ],
      "w": 60,
      "h": 34,
      "x": 0.57,
      "y": 0.07,
      "id": "menu",
      "label": "Menu"
    }
  ]
}
